<?xml version="1.0" encoding="UTF-8"?>
<xs:schema xmlns:xs="http://www.w3.org/2001/XMLSchema" elementFormDefault="qualified">
<xs:element name="libros">
    <xs:complexType>
        <xs:sequence>
            <xs:element name="libro" minOccurs="1" maxOccurs="unbounded">
                <xs:complexType>
                    <xs:sequence>
                        <xs:element name="titulo" type="xs:string"/>
                        <xs:element name="fechaPubli" type="xs:date"/>
                        <xs:element name="ref" type="xs:string"/>

                        <xs:element name="precio">
                            <xs:complexType>
                                <xs:simpleContent>
                                    <xs:extension base="xs:decimal">
                                        <xs:attribute name="divisa" default="â‚¬" use="optional"/>
                                    </xs:extension>
                                </xs:simpleContent>
                            </xs:complexType>
                        </xs:element>
                    </xs:sequence>
                    <xs:attribute name="disponible" type="xs:boolean" default="true" use="optional" />
                </xs:complexType>
            </xs:element>
        </xs:sequence>
    </xs:complexType>
</xs:element>
</xs:schema>